{
  "$schema": "../schemas/year.schema.json",
  "country": "PK",
  "country_name": "Pakistan",
  "hijri_year": 1448,
  "calendar_basis": "pakistan_moon_sighting",
  "months": [
    {
      "month": 1,
      "month_name": "Muharram",
      "gregorian_start_date": "2026-06-17",
      "status": "verified",
      "confidence": "high",
      "sources": [
        {
          "source_name": "Associated Press of Pakistan (APP)",
          "description": "APP reported the Central Ruet-e-Hilal Committee announcement that the Muharram-ul-Haram 1448 AH moon was not sighted in Pakistan and that 1 Muharram would fall on Wednesday, June 17, 2026.",
          "url": "https://www.app.com.pk/national/muharram-to-begin-on-june-17-as-moon-not-sighted-in-pakistan/",
          "published_at": "2026-06-15"
        }
      ],
      "notes": "The Central Ruet-e-Hilal Committee announced that the Muharram-ul-Haram 1448 AH moon was not sighted in Pakistan; therefore 1 Muharram 1448 falls on Wednesday, June 17, 2026."
    },
    {
      "month": 2,
      "month_name": "Safar",
      "gregorian_start_date": "2026-07-16",
      "status": "verified",
      "confidence": "high",
      "sources": [
        {
          "source_name": "Central Ruet-e-Hilal Committee",
          "description": "Official decision confirming the Safar crescent was sighted. 1 Safar 1448 AH begins on 16 July 2026.",
          "url": "https://minutemirror.com.pk/1st-safar-1448-ah-to-be-observed-on-thursday-july-16-591799/?utm_source=chatgpt.com",
          "published_at": "2026-07-16"
        }
      ],
      "notes": ""
    },
    {
      "month": 3,
      "month_name": "Rabi al-Awwal",
      "gregorian_start_date": "2026-08-15",
      "status": "verified",
      "confidence": "high",
      "sources": [
        {
          "source_name": "Radio Pakistan",
          "description": "Radio Pakistan reported the Central Ruet-e-Hilal Committee announcement that the Rabi-ul-Awwal 1448 AH moon was not sighted in Pakistan and that 1 Rabi-ul-Awwal would fall on Saturday, August 15, 2026.",
          "url": "https://www.radio.gov.pk/13-08-2026/moon-not-sighted-first-of-rabi-ul-awwal-on-saturday",
          "published_at": "2026-08-13"
        }
      ],
      "notes": "The Central Ruet-e-Hilal Committee announced that the Rabi-ul-Awwal 1448 AH moon was not sighted in Pakistan; therefore 1 Rabi-ul-Awwal 1448 falls on Saturday, August 15, 2026."
    },
    {
      "month": 4,
      "month_name": "Rabi al-Thani",
      "gregorian_start_date": "2026-09-14",
      "status": "verified",
      "confidence": "high",
      "sources": [
        {
          "source_name": "AAJ News",
          "description": "AAJ News reported the Central Ruet-e-Hilal Committee announcement that the Rabi al-Thani 1448 AH moon was not sighted in Pakistan and that 1 Rabi al-Thani would fall on Monday, September 14, 2026. The report states that the Ministry of Religious Affairs issued the notification after the committee's announcement.",
          "url": "https://www.aaj.tv/news/30517000",
          "published_at": "2026-09-12"
        }
      ],
      "notes": "The Central Ruet-e-Hilal Committee announced that the Rabi al-Thani 1448 AH moon was not sighted in Pakistan; therefore 1 Rabi al-Thani 1448 falls on Monday, September 14, 2026."
    },
    {
      "month": 5,
      "month_name": "Jumada al-Awwal",
      "gregorian_start_date": "2026-10-13",
      "status": "verified",
      "confidence": "high",
      "sources": [
        {
          "source_name": "Associated Press of Pakistan (APP)",
          "description": "APP reported that the Jamadi-ul-Awwal 1448 AH moon was sighted in Pakistan on Monday evening, October 12, and that the Ministry of Religious Affairs issued an official notification. The first day of Jamadi-ul-Awwal was announced for Tuesday, October 13, 2026.",
          "url": "https://www.app.com.pk/national/jamadi-ul-awwal-moon-sighted-in-pakistan-first-day-to-fall-on-october-13/",
          "published_at": "2026-10-12"
        }
      ],
      "notes": "The Central Ruet-e-Hilal Committee announced that the Jamadi-ul-Awwal 1448 AH moon was sighted in Pakistan on Monday evening; therefore 1 Jumada al-Awwal 1448 falls on Tuesday, October 13, 2026."
    },
    {
      "month": 6,
      "month_name": "Jumada al-Thani",
      "gregorian_start_date": "",
      "status": "pending",
      "confidence": "unknown",
      "sources": [],
      "notes": ""
    },
    {
      "month": 7,
      "month_name": "Rajab",
      "gregorian_start_date": "",
      "status": "pending",
      "confidence": "unknown",
      "sources": [],
      "notes": ""
    },
    {
      "month": 8,
      "month_name": "Sha'ban",
      "gregorian_start_date": "",
      "status": "pending",
      "confidence": "unknown",
      "sources": [],
      "notes": ""
    },
    {
      "month": 9,
      "month_name": "Ramadan",
      "gregorian_start_date": "",
      "status": "pending",
      "confidence": "unknown",
      "sources": [],
      "notes": ""
    },
    {
      "month": 10,
      "month_name": "Shawwal",
      "gregorian_start_date": "",
      "status": "pending",
      "confidence": "unknown",
      "sources": [],
      "notes": ""
    },
    {
      "month": 11,
      "month_name": "Dhu al-Qadah",
      "gregorian_start_date": "",
      "status": "pending",
      "confidence": "unknown",
      "sources": [],
      "notes": ""
    },
    {
      "month": 12,
      "month_name": "Dhu al-Hijjah",
      "gregorian_start_date": "",
      "status": "pending",
      "confidence": "unknown",
      "sources": [],
      "notes": ""
    }
  ]
}
